{
  "as_is_graph": {
    "build_readiness": null,
    "details": {
      "detail-as-draft": {
        "applied_skills": [],
        "asset_ref": null,
        "config": {},
        "current_work": "검색한 메일 내용을 사람이 업무, 성과, 이슈 항목으로 옮겨 적는다.",
        "failure_policy": {},
        "human_review": null,
        "improvement": "근거 우선 요약 Skill을 적용한 신규 adapter가 문장별 source_ref를 유지한다.",
        "inputs": [],
        "outputs": [],
        "problems": [
          "초안 문장과 원본 메일의 연결 근거가 끊기고 반복 편집이 많다."
        ],
        "reuse_decision_reason": "선택한 구현 방식과 검증 범위를 설계 단계에서 명시합니다.",
        "secrets_permissions": [],
        "tests": [],
        "title": "업무보고 수동 작성"
      },
      "detail-as-end": {
        "applied_skills": [],
        "asset_ref": null,
        "config": {},
        "current_work": "승인된 문서를 포털에 올리고 링크를 별도로 전달한다.",
        "failure_policy": {},
        "human_review": null,
        "improvement": "승인 상태가 확인된 경우에만 Report API가 게시하고 감사 추적 ID와 링크를 반환한다.",
        "inputs": [],
        "outputs": [],
        "problems": [
          "승인 전 게시 여부와 게시 결과를 일관되게 추적하기 어렵다."
        ],
        "reuse_decision_reason": "선택한 구현 방식과 검증 범위를 설계 단계에서 명시합니다.",
        "secrets_permissions": [],
        "tests": [],
        "title": "업무보고 공유 완료"
      },
      "detail-as-review": {
        "applied_skills": [],
        "asset_ref": null,
        "config": {},
        "current_work": "담당자가 완성된 문서를 다시 읽으며 누락과 민감정보를 확인한다.",
        "failure_policy": {},
        "human_review": null,
        "improvement": "게시 직전 Human 승인 gate에서 승인, 수정 요청, 거절을 명시적으로 기록한다.",
        "inputs": [],
        "outputs": [],
        "problems": [
          "검토 여부와 수정 사유가 구조화되어 남지 않는다."
        ],
        "reuse_decision_reason": "선택한 구현 방식과 검증 범위를 설계 단계에서 명시합니다.",
        "secrets_permissions": [],
        "tests": [],
        "title": "민감정보와 내용 검토"
      },
      "detail-as-search": {
        "applied_skills": [],
        "asset_ref": null,
        "config": {},
        "current_work": "담당자가 Outlook에서 기간과 발신자를 바꿔가며 업무 메일을 직접 찾는다.",
        "failure_policy": {},
        "human_review": null,
        "improvement": "승인된 조회 범위만 사용하는 standalone 수집 Component로 원문 참조를 함께 보존한다.",
        "inputs": [],
        "outputs": [],
        "problems": [
          "메일을 하나씩 열어야 하며 원문 근거를 다시 찾는 시간이 길다."
        ],
        "reuse_decision_reason": "선택한 구현 방식과 검증 범위를 설계 단계에서 명시합니다.",
        "secrets_permissions": [],
        "tests": [],
        "title": "Outlook 메일 수동 검색"
      },
      "detail-as-start": {
        "applied_skills": [],
        "asset_ref": null,
        "config": {},
        "current_work": "담당자가 금요일에 직접 조회 기간과 보고 대상 범위를 정한다.",
        "failure_policy": {},
        "human_review": null,
        "improvement": "정기 실행 또는 수동 요청을 하나의 승인된 실행 계약으로 받는다.",
        "inputs": [],
        "outputs": [],
        "problems": [
          "실행 기준이 사람마다 달라 누락 범위가 생길 수 있다."
        ],
        "reuse_decision_reason": "선택한 구현 방식과 검증 범위를 설계 단계에서 명시합니다.",
        "secrets_permissions": [],
        "tests": [],
        "title": "금요일 보고 준비 시작"
      }
    },
    "edges": [
      {
        "condition": null,
        "connection_validation_status": "unverified",
        "edge_id": "as-e1",
        "edge_kind": "data",
        "is_default": false,
        "label": "작성 시작",
        "mapping": {},
        "retry_policy": {},
        "source_node_id": "as-start",
        "source_port_id": null,
        "target_node_id": "as-search",
        "target_port_id": null
      },
      {
        "condition": null,
        "connection_validation_status": "unverified",
        "edge_id": "as-e2",
        "edge_kind": "data",
        "is_default": false,
        "label": "검색 결과",
        "mapping": {},
        "retry_policy": {},
        "source_node_id": "as-search",
        "source_port_id": null,
        "target_node_id": "as-draft",
        "target_port_id": null
      },
      {
        "condition": null,
        "connection_validation_status": "unverified",
        "edge_id": "as-e3",
        "edge_kind": "data",
        "is_default": false,
        "label": "초안 검토",
        "mapping": {},
        "retry_policy": {},
        "source_node_id": "as-draft",
        "source_port_id": null,
        "target_node_id": "as-review",
        "target_port_id": null
      },
      {
        "condition": null,
        "connection_validation_status": "unverified",
        "edge_id": "as-e4",
        "edge_kind": "data",
        "is_default": false,
        "label": "승인 후 공유",
        "mapping": {},
        "retry_policy": {},
        "source_node_id": "as-review",
        "source_port_id": null,
        "target_node_id": "as-end",
        "target_port_id": null
      }
    ],
    "generation_requests": {},
    "graph_id": "as_is-business-flow",
    "graph_kind": "as_is",
    "groups": [],
    "layout_direction": "left_to_right",
    "nodes": [
      {
        "applied_skills": [],
        "detail_ref": "detail-as-start",
        "generation_request_ref": null,
        "implementation_label": "Human",
        "implementation_source": "human_task",
        "input_ports": [],
        "node_id": "as-start",
        "node_kind": "start",
        "output_ports": [],
        "port_contract_sha256": null,
        "sequence": 1,
        "source_node_id": "as-start",
        "summary": "담당자가 금요일에 직접 조회 기간과 보고 대상 범위를 정한다.",
        "technical_contract_status": null,
        "title": "금요일 보고 준비 시작"
      },
      {
        "applied_skills": [],
        "detail_ref": "detail-as-search",
        "generation_request_ref": null,
        "implementation_label": "Human",
        "implementation_source": "human_task",
        "input_ports": [],
        "node_id": "as-search",
        "node_kind": "work_step",
        "output_ports": [],
        "port_contract_sha256": null,
        "sequence": 2,
        "source_node_id": "as-search",
        "summary": "담당자가 Outlook에서 기간과 발신자를 바꿔가며 업무 메일을 직접 찾는다.",
        "technical_contract_status": null,
        "title": "Outlook 메일 수동 검색"
      },
      {
        "applied_skills": [],
        "detail_ref": "detail-as-draft",
        "generation_request_ref": null,
        "implementation_label": "Human",
        "implementation_source": "human_task",
        "input_ports": [],
        "node_id": "as-draft",
        "node_kind": "work_step",
        "output_ports": [],
        "port_contract_sha256": null,
        "sequence": 3,
        "source_node_id": "as-draft",
        "summary": "검색한 메일 내용을 사람이 업무, 성과, 이슈 항목으로 옮겨 적는다.",
        "technical_contract_status": null,
        "title": "업무보고 수동 작성"
      },
      {
        "applied_skills": [],
        "detail_ref": "detail-as-review",
        "generation_request_ref": null,
        "implementation_label": "Human",
        "implementation_source": "human_task",
        "input_ports": [],
        "node_id": "as-review",
        "node_kind": "human_gate",
        "output_ports": [],
        "port_contract_sha256": null,
        "sequence": 4,
        "source_node_id": "as-review",
        "summary": "담당자가 완성된 문서를 다시 읽으며 누락과 민감정보를 확인한다.",
        "technical_contract_status": null,
        "title": "민감정보와 내용 검토"
      },
      {
        "applied_skills": [],
        "detail_ref": "detail-as-end",
        "generation_request_ref": null,
        "implementation_label": "Human",
        "implementation_source": "human_task",
        "input_ports": [],
        "node_id": "as-end",
        "node_kind": "end",
        "output_ports": [],
        "port_contract_sha256": null,
        "sequence": 5,
        "source_node_id": "as-end",
        "summary": "승인된 문서를 포털에 올리고 링크를 별도로 전달한다.",
        "technical_contract_status": null,
        "title": "업무보고 공유 완료"
      }
    ],
    "text_fallback": [
      "1. 금요일 보고 준비 시작: 담당자가 금요일에 직접 조회 기간과 보고 대상 범위를 정한다.",
      "2. Outlook 메일 수동 검색: 담당자가 Outlook에서 기간과 발신자를 바꿔가며 업무 메일을 직접 찾는다.",
      "3. 업무보고 수동 작성: 검색한 메일 내용을 사람이 업무, 성과, 이슈 항목으로 옮겨 적는다.",
      "4. 민감정보와 내용 검토: 담당자가 완성된 문서를 다시 읽으며 누락과 민감정보를 확인한다.",
      "5. 업무보고 공유 완료: 승인된 문서를 포털에 올리고 링크를 별도로 전달한다."
    ]
  },
  "renderer_version": "business-report-renderer.v1",
  "report_id": "report-919c19197e5f97853676a15d",
  "retrieval_trace": {
    "approved_hash": "sha256:86a9c68d6acb5958adc46a74a3e3479cfe7cfd6e553082359174b42df9cd07ba",
    "candidate_allowlist": [
      {
        "asset_id": "47d41a8d-9208-48c2-b79b-9d84d7ce199d",
        "asset_type": "flow",
        "port_contract_sha256": "sha256:cc720a324af5727c74f00b41fb209465e50885fadb5f14831028fa4b418d3ccc",
        "technical_contract_status": "metadata_only",
        "version": "v1.0.0"
      },
      {
        "asset_id": "e21931b2-1093-4f32-b55a-36ac66ef5b59",
        "asset_type": "component",
        "port_contract_sha256": "sha256:cc720a324af5727c74f00b41fb209465e50885fadb5f14831028fa4b418d3ccc",
        "technical_contract_status": "metadata_only",
        "version": "v1.0.1"
      }
    ],
    "candidate_allowlist_sha256": "sha256:9394d3730e4a8f757a3b01851613215d69cde12d0bfc257a8cb9bc88273e1f9d",
    "catalog_candidate_status": "available",
    "catalog_presentation": [
      {
        "asset_id": "47d41a8d-9208-48c2-b79b-9d84d7ce199d",
        "asset_type": "flow",
        "category": "",
        "description": "메일을 수집해 업무보고를 만드는 기존 Flow 후보",
        "port_contract_sha256": "sha256:cc720a324af5727c74f00b41fb209465e50885fadb5f14831028fa4b418d3ccc",
        "technical_contract_status": "metadata_only",
        "title": "email기반 자동 업무보고 만들기",
        "version": "v1.0.0"
      },
      {
        "asset_id": "e21931b2-1093-4f32-b55a-36ac66ef5b59",
        "asset_type": "component",
        "category": "",
        "description": "Outlook 연계 방식 참고용 Component 후보",
        "port_contract_sha256": "sha256:cc720a324af5727c74f00b41fb209465e50885fadb5f14831028fa4b418d3ccc",
        "technical_contract_status": "metadata_only",
        "title": "Outlook일정가지고오기 component(GetScheduleComponent)",
        "version": "v1.0.1"
      }
    ],
    "catalog_reference_policy": "allow_candidate_allowlist",